{
  "document_id": "087ef62c9db9d929",
  "source_file": "UPS-LOCAL-696-RIDER.pdf",
  "document_type": "Rider",
  "title": "NATIONAL MASTER",
  "parties": {
    "employer": "United Parcel Service (UPS)",
    "union": "International Brotherhood of Teamsters (IBT)",
    "local_number": "696",
    "geographic_region": "Central Region"
  },
  "effective_date": "August 1, 2023",
  "expiration_date": "July 31, 2028",
  "contract_duration_days": 1826,
  "page_count": 3,
  "word_count": 339,
  "headers": [
    {
      "text": "NATIONAL MASTER",
      "page": 1,
      "level": 1
    }
  ],
  "sections": [],
  "articles": [],
  "key_topics": [
    "seniority",
    "supplemental_work",
    "feeders"
  ],
  "wage_parameters": [],
  "time_parameters": [
    {
      "type": "waiting_period",
      "value": 30,
      "unit": "days",
      "description": "less than 30 days, said dri",
      "article": null,
      "section": null,
      "page": null
    }
  ],
  "benefit_parameters": [],
  "cross_references": [],
  "extraction_method": "pypdf-tier0",
  "extraction_metadata": {
    "extracted_at": "2026-04-08T23:13:33.611833+00:00",
    "extractor_version": "2.1.0",
    "schema_version": "v2",
    "extraction_notes": []
  }
}