{
  "document_id": "400c19ba39103c24",
  "source_file": "13124UPSMICHIGANRIDER.pdf",
  "document_type": "Rider",
  "title": "NATIONAL MASTER",
  "parties": {
    "employer": "United Parcel Service (UPS)",
    "union": "International Brotherhood of Teamsters (IBT)",
    "local_number": null,
    "geographic_region": "Central Region"
  },
  "effective_date": "January 7, 1980",
  "expiration_date": "July 31, 2028",
  "contract_duration_days": 17738,
  "page_count": 9,
  "word_count": 902,
  "headers": [
    {
      "text": "NATIONAL MASTER",
      "page": 1,
      "level": 1
    },
    {
      "text": "Article 3: UNION SHOP AND DUES................................... 278",
      "page": 4,
      "level": 2
    },
    {
      "text": "Article 14: HEALTH AND WELFARE ................................ 278",
      "page": 4,
      "level": 2
    },
    {
      "text": "Article 16: VACATION ..........................................................278",
      "page": 4,
      "level": 2
    },
    {
      "text": "Article 17: GRIEVANCE PROCEDURE ..............................279",
      "page": 4,
      "level": 2
    },
    {
      "text": "Article 18: MEAL PERIOD ...................................................279",
      "page": 4,
      "level": 2
    }
  ],
  "sections": [],
  "articles": [
    {
      "article_number": "3",
      "title": "UNION SHOP AND DUES................................... 278",
      "page_start": 4,
      "page_end": 4,
      "section_count": 0,
      "word_count": 0
    },
    {
      "article_number": "14",
      "title": "HEALTH AND WELFARE ................................ 278",
      "page_start": 4,
      "page_end": 4,
      "section_count": 0,
      "word_count": 3
    },
    {
      "article_number": "16",
      "title": "VACATION ..........................................................278",
      "page_start": 4,
      "page_end": 4,
      "section_count": 0,
      "word_count": 0
    },
    {
      "article_number": "17",
      "title": "GRIEVANCE PROCEDURE ..............................279",
      "page_start": 4,
      "page_end": 4,
      "section_count": 0,
      "word_count": 0
    },
    {
      "article_number": "18",
      "title": "MEAL PERIOD ...................................................279",
      "page_start": 4,
      "page_end": null,
      "section_count": 0,
      "word_count": 795
    }
  ],
  "key_topics": [
    "wages",
    "health_and_welfare",
    "discipline",
    "grievance_arbitration",
    "vacations",
    "job_classifications",
    "supplemental_work",
    "part_time_employees",
    "full_time_employees",
    "mechanics"
  ],
  "wage_parameters": [
    {
      "type": "hourly",
      "value": 42.65,
      "currency": "USD",
      "unit": "hour",
      "classification": "Car Wash",
      "progression_step": "top_rate",
      "article": null,
      "section": null,
      "page": null
    },
    {
      "type": "hourly",
      "value": 43.7,
      "currency": "USD",
      "unit": "hour",
      "classification": "Sorters",
      "progression_step": "top_rate",
      "article": null,
      "section": null,
      "page": null
    },
    {
      "type": "hourly",
      "value": 43.7,
      "currency": "USD",
      "unit": "hour",
      "classification": "Preloaders",
      "progression_step": "top_rate",
      "article": null,
      "section": null,
      "page": null
    },
    {
      "type": "hourly",
      "value": 44.75,
      "currency": "USD",
      "unit": "hour",
      "classification": "Mechanic",
      "progression_step": "top_rate",
      "article": null,
      "section": null,
      "page": null
    },
    {
      "type": "hourly",
      "value": 44.0,
      "currency": "USD",
      "unit": "hour",
      "classification": "Mechanic",
      "progression_step": "top_rate",
      "article": null,
      "section": null,
      "page": null
    }
  ],
  "time_parameters": [],
  "benefit_parameters": [],
  "cross_references": [],
  "extraction_method": "pypdf-tier0",
  "extraction_metadata": {
    "extracted_at": "2026-04-08T23:13:23.467461+00:00",
    "extractor_version": "2.1.0",
    "schema_version": "v2",
    "extraction_notes": []
  }
}