{
  "document_id": "e2657d8eb0350e1c",
  "source_file": "13124UPSKENTUCKYRIDER.pdf",
  "document_type": "Rider",
  "title": "NATIONAL MASTER",
  "parties": {
    "employer": "United Parcel Service (UPS)",
    "union": "International Brotherhood of Teamsters (IBT)",
    "local_number": null,
    "geographic_region": "Central Region"
  },
  "effective_date": "August 1, 2023",
  "expiration_date": "July 31, 2028",
  "contract_duration_days": 1826,
  "page_count": 17,
  "word_count": 2736,
  "headers": [
    {
      "text": "NATIONAL MASTER",
      "page": 1,
      "level": 1
    },
    {
      "text": "Article 3: Article 3",
      "page": 6,
      "level": 2
    },
    {
      "text": "Section 1: Employee Seniority",
      "page": 6,
      "level": 3
    },
    {
      "text": "Section 2: Posting List",
      "page": 7,
      "level": 3
    },
    {
      "text": "Section 3: Work Assignment",
      "page": 7,
      "level": 3
    },
    {
      "text": "Section 4: Filling Vacancies",
      "page": 7,
      "level": 3
    },
    {
      "text": "Section 5: Displaced Employee",
      "page": 9,
      "level": 3
    },
    {
      "text": "Section 6: Posting Feeder and Spotter Jobs",
      "page": 12,
      "level": 3
    },
    {
      "text": "Section 7: Layoffs",
      "page": 13,
      "level": 3
    }
  ],
  "sections": [
    {
      "section_id": "3.1",
      "parent_article": "3",
      "title": "Employee Seniority",
      "page_start": 6,
      "page_end": 7,
      "word_count": 68
    },
    {
      "section_id": "3.2",
      "parent_article": "3",
      "title": "Posting List",
      "page_start": 7,
      "page_end": 7,
      "word_count": 36
    },
    {
      "section_id": "3.3",
      "parent_article": "3",
      "title": "Work Assignment",
      "page_start": 7,
      "page_end": 7,
      "word_count": 252
    },
    {
      "section_id": "3.4",
      "parent_article": "3",
      "title": "Filling Vacancies",
      "page_start": 7,
      "page_end": 9,
      "word_count": 555
    },
    {
      "section_id": "3.5",
      "parent_article": "3",
      "title": "Displaced Employee",
      "page_start": 9,
      "page_end": 12,
      "word_count": 1029
    },
    {
      "section_id": "3.6",
      "parent_article": "3",
      "title": "Posting Feeder and Spotter Jobs",
      "page_start": 12,
      "page_end": 13,
      "word_count": 109
    },
    {
      "section_id": "3.7",
      "parent_article": "3",
      "title": "Layoffs",
      "page_start": 13,
      "page_end": null,
      "word_count": 452
    }
  ],
  "articles": [
    {
      "article_number": "3",
      "title": "Article 3",
      "page_start": 6,
      "page_end": null,
      "section_count": 7,
      "word_count": 2535
    }
  ],
  "key_topics": [
    "wages",
    "benefits",
    "health_and_welfare",
    "seniority",
    "discipline",
    "vacations",
    "job_classifications",
    "supplemental_work",
    "part_time_employees",
    "full_time_employees",
    "feeders",
    "package_delivery",
    "mechanics"
  ],
  "wage_parameters": [
    {
      "type": "hourly",
      "value": 41.59,
      "currency": "USD",
      "unit": "hour",
      "classification": "Package Car Drivers",
      "progression_step": "top_rate",
      "article": null,
      "section": null,
      "page": null
    },
    {
      "type": "hourly",
      "value": 41.73,
      "currency": "USD",
      "unit": "hour",
      "classification": "Drivers",
      "progression_step": "top_rate",
      "article": null,
      "section": null,
      "page": null
    },
    {
      "type": "hourly",
      "value": 41.04,
      "currency": "USD",
      "unit": "hour",
      "classification": "Sorters/Preload",
      "progression_step": "top_rate",
      "article": null,
      "section": null,
      "page": null
    },
    {
      "type": "hourly",
      "value": 41.84,
      "currency": "USD",
      "unit": "hour",
      "classification": "Mechanics",
      "progression_step": "top_rate",
      "article": null,
      "section": null,
      "page": null
    },
    {
      "type": "hourly",
      "value": 41.04,
      "currency": "USD",
      "unit": "hour",
      "classification": "Sorters/Pl",
      "progression_step": "top_rate",
      "article": null,
      "section": null,
      "page": null
    },
    {
      "type": "hourly",
      "value": 41.49,
      "currency": "USD",
      "unit": "hour",
      "classification": "Package Car Drivers",
      "progression_step": "top_rate",
      "article": null,
      "section": null,
      "page": null
    },
    {
      "type": "hourly",
      "value": 41.64,
      "currency": "USD",
      "unit": "hour",
      "classification": "Drivers",
      "progression_step": "top_rate",
      "article": null,
      "section": null,
      "page": null
    },
    {
      "type": "hourly",
      "value": 41.09,
      "currency": "USD",
      "unit": "hour",
      "classification": "Sorters/Preload",
      "progression_step": "top_rate",
      "article": null,
      "section": null,
      "page": null
    },
    {
      "type": "hourly",
      "value": 41.09,
      "currency": "USD",
      "unit": "hour",
      "classification": "Sorters/Pl",
      "progression_step": "top_rate",
      "article": null,
      "section": null,
      "page": null
    }
  ],
  "time_parameters": [
    {
      "type": "waiting_period",
      "value": 30,
      "unit": "working_days",
      "description": "period of 30 working days.\n- 283 -",
      "article": null,
      "section": null,
      "page": null
    }
  ],
  "benefit_parameters": [],
  "cross_references": [],
  "extraction_method": "pypdf-tier0",
  "extraction_metadata": {
    "extracted_at": "2026-04-08T23:13:19.845339+00:00",
    "extractor_version": "2.1.0",
    "schema_version": "v2",
    "extraction_notes": []
  }
}